record_contributor,objectid,filename,youtubeid,title,creator,date,description,subject,location,latitude,longitude,source,identifier,type,format_original,format,rightsstatement
Amin Rezamand,hist454-ar01,https://digital.lib.uidaho.edu/digital/iiif/bar-stock/1061/full/max/0/default.jpg,,"North American Mining Co., Kellogg (Idaho) 1916 [01]","Barnard Studio (Wallace, Idaho)",1916,Winter Scene of the mine,winter; mine buildings,"Kellogg, Idaho",47.502099,-116.099099,"PG 8, Barnard-Stockbridge Collection",PG 8-X550a,Image;StillImage,8x10 black and white glass negative,image/jpeg,http://rightsstatements.org/vocab/NoC-US/1.0/
Amin Rezamand,hist454-ar02,https://digital.lib.uidaho.edu/digital/iiif/bar-stock/492/full/max/0/default.jpg,,"Standard Mine, Mace (Idaho) [05]","Barnard Studio (Wallace, Idaho)",1903,"View of a portal for the Standard Mine. A little cabin stands uphill, with a larger wooden building below. Caption from front: ""Distant view of entrance.""",buildings; mines (extracting complexes); trees,"Burke, Idaho",47.524054,-115.811054,"PG 8, Barnard-Stockbridge Collection",PG 8-X278d,Image;StillImage,8x10 black and white glass negative,image/jpeg,http://rightsstatements.org/vocab/NoC-US/1.0/
Amin Rezamand,hist454-ar03,https://digital.lib.uidaho.edu/digital/iiif/bar-stock/325/full/max/0/default.jpg,,"Laclede Mine, Burke (Idaho), 1908 [01]","Barnard Studio (Wallace, Idaho)",1908,"This photo shows a group of twelve people and one horse, standing in front of a log building on the Laclede Mine property.",groups of people; trees; riding horses; dwellings; buildings,"Burke, Idaho",47.543099,-115.837099,"PG 8, Barnard-Stockbridge Collection",PG 8-X263a,Image;StillImage,8x10 black and white glass negative,image/jpeg,http://rightsstatements.org/vocab/NoC-US/1.0/
Amin Rezamand,hist454-ar04,https://digital.lib.uidaho.edu/digital/iiif/bar-stock/949/full/max/0/default.jpg,,"Hercules Mill, Wallace (Idaho) 1912-1917","Barnard Studio (Wallace, Idaho)",1912,Exterior view of the mill,mills,"Wallace, Idaho",47.473662,-115.923899,"PG 8, Barnard-Stockbridge Collection",PG 8-X528,Image;StillImage,8x10 black and white glass negative,image/jpeg,http://rightsstatements.org/vocab/NoC-US/1.0/
Amin Rezamand,hist454-ar05,https://digital.lib.uidaho.edu/digital/iiif/bar-stock/452/full/max/0/default.jpg,,"Pittsburg Consolidated Mine, Wallace (Idaho), 1907","Barnard Studio (Wallace, Idaho)",1907,Far view of the Pittsburg Consolidated Mine covered in snow,mines (buildings); snowfields,"Wallace, Idaho",47.479714,-116.199549,"PG 8, Barnard-Stockbridge Collection",PG 8-X327,Image;StillImage,8x10 black and white glass negative,image/jpeg,http://rightsstatements.org/vocab/NoC-US/1.0/
Amin Rezamand,hist454-ar06,hist454-AR001.jpg,,"Hercules Mining Company, Burke, Idaho",Barnard-Stockbridge Collection,1908,"Taken for Mr. Day, Sept. 1, for lawsuit.","mining company; lawsuit; Burke, Idaho","Burke, Idaho",47.5561686,-115.906885,"Barnard-Stockbridge Collection, University of Idaho Library",8-A 74 L,Image;StillImage,black-and-white photograph,image/jpeg,http://rightsstatements.org/vocab/InC-EDU/1.0/
Amin Rezamand,hist454-ar07,hist454-AR002.jpg,,"FW Bradley corresp. from WI Elmenclorf re BH mine, 1908-1910",Bunker Hill Mining Company,1908-08-28,Letter sent to the manager of Bunker Hill Mining Company about a financial matter,letter; Bunker Hill; kellogg; manager,"Kellogg, Idaho",47.5116034,-116.1539202,"Bunker Hill Mining Company, University of Idaho Library",no. 1591,Text,printed letter,image/jpeg,http://rightsstatements.org/vocab/NoC-US/1.0/
Amin Rezamand,hist454-ar08,hist454-AR003.pdf,,"FW Bradley corresp. from WI Elmenclorf re BH mine, 1908-1911",Bunker Hill Mining Company,1908-09-29,Letter sent to the president of Bunker Hill Mining Company,mining engineer; Bunker Hill; kellogg; president,"Kellogg, Idaho",47.5116034,-116.1539202,"Bunker Hill Mining Company, University of Idaho Library",no. 1591,Text,printed letter,application/pdf,http://rightsstatements.org/vocab/NoC-US/1.0/
Ross Chadderdon,Hist454-RC001,hist454-RC001.jpg,,float in a 4th of July parade,University of Idaho,1910,Crowd of people on each side of the road watching a float drive down the sreet in 4th of July parade.,float; parade; 4th of July,"Coeur D'Alene, Idaho",47.6745,-116.7812,https://www.lib.uidaho.edu/digital/barstock/items/barstock133.html,,image;still,photograph,image/jpeg,http://rightsstatements.org/vocab/InC-EDU/1.0/
Ross Chadderdon,Hist454-RC002,hist454-RC002.jpg,,3 old men driving a car in the parade,University of Idaho,1910,3 men driving convertabke car in 4 th of july parade,old men; car; parade,"Coeur D'Alene, Idaho",47.6745,-116.7812,https://www.lib.uidaho.edu/digital/barstock/items/barstock133.html,,image;still,photograph,image/jpeg,http://rightsstatements.org/vocab/InC-EDU/1.0/
Ross Chadderdon,Hist454-RC003,hist454-RC003.jpg,,Fourth of July Crowd,University of Idaho,1910,"around 35,000 people gathered around the streets to watch the fourth of July parade",parade; 4th of July,"Coeur D'Alene, Idaho",47.6745,-116.7812,https://www.lib.uidaho.edu/digital/barstock/items/barstock133.html,,image;still,newspaper article,image/jpeg,http://rightsstatements.org/vocab/InC-EDU/1.0/
Ross Chadderdon,Hist454-RC004,https://digital.lib.uidaho.edu/utils/getfile/collection/bunkerhill/id/345.pdf,,"Operative report for Frisco Cons'd Mining Co., no date, transcribed December 01, 1900",Thiel Detective Service Co.,1900,"Operative reports that many men are out of work, a possible change in management at the F. & H. Mine, and a list of 10 union members.",miners; labor unions,"Seattle, Washington",47.62135367,-122.3517407,"MG 5, Stanly Easton. Papers, 1900-1916, University of Idaho Library Special Collections and Archives",MG5_F001_043,text,Letter,application/pdf,https://creativecommons.org/publicdomain/mark/1.0/
Ross Chadderdon,Hist454-RC005,https://www.lib.uidaho.edu/digital/objects/tabor/pg83-b05-f46-024_001.jpg,,"Labor building on Bank Street, Wallace","Tabor's Photo Service, Wallace Idaho",1942-06-16,"The Labor building on Bank Street in Wallace, Idaho. Two cars are parked in front of the building.",employment agencies; building,"Wallace, Idaho",47.4741,-115.9279,"PG 83, George W. Tabor Photographs, 1890-2141, https://www.lib.uidaho.edu/digital/tabor/items/tabor0177.html",pg83-b05-f46-024_001,Image;StillImage,image,image/jpeg,http://rightsstatements.org/vocab/InC-EDU/1.0/
Ross Chadderdon,Hist454-RC006,https://www.lib.uidaho.edu/digital/objects/tabor/pg83-b05-f47-001_001.jpg,,"Possible Funeral for a mining accident that killed 10 people after a cable broke, Mullan, Idaho","Tabor's Photo Service, Wallace Idaho",1936-10-05,"People gather after a mining accident that killed 10 people at Morning Mine. Large bags, containing the bodies of the dead, are being brought out. Machinery and buildings can be seen in the background.",accidents; mining; funeral,"Mullan, Idaho",47.47018875,-115.8011691,"PG 83, George W. Tabor Photographs, 1890-2164, https://www.lib.uidaho.edu/digital/tabor/items/tabor0200.html",pg83-b05-f47-001_001,Image;StillImage,photograph,image/jpeg,http://rightsstatements.org/vocab/InC-EDU/1.0/
Ross Chadderdon,Hist454-RC007,https://www.lib.uidaho.edu/digital/objects/tabor/pg83-b05-f47-005_004.jpg,,Man standing next to Coeur d'Alene Mining District Mine Rescue Car,"Tabor's Photo Service, Wallace Idaho",1939-01-12,"A man stands next to a Coeur d'Alene Mining District Mine Rescue Car. The text on the automobile also reads ""Wallace Idaho 1939.""",automobiles; mines,"Coeur D'Alene, Idaho",47.6745,-116.7812,"PG 83, George W. Tabor Photographs, 1890-2164, https://www.lib.uidaho.edu/digital/tabor/items/tabor0217.html",pg83-b05-f47-005_004,Image;StillImage,photograph,image/jpeg,http://rightsstatements.org/vocab/InC-EDU/1.0/
