record_contributor,objectid,filename,youtubeid,title,creator,date,description,subject,location,latitude,longitude,source,identifier,type,format_original,format,rightsstatement
Anra Rowley,hist454-ar03,https://digital.lib.uidaho.edu/utils/getfile/collection/bunkerhill/id/452.pdf,,"4 operative reports, three on May 25, 1901, May 26, 1901",Thiel Detective Service Co.,1901-05-25,"May 25 (1): Operative mentions rumors about union members, the Finley trial, and property owned by Bunker Hill Mining Co.; May 25 (2): operative mentions speculation on employment of union men; May 25 (3): operative discusses in depth his investigation of the murder of Martin Fisher; May 26: operative discusses a previous murder of a blacksmith named ""Kneebone"", mentions threats againts the mine managers and deputies, and the investigation of Martin Fisher; three pages.",travel; labor unions; murder; mining; legal disputes; miners; detectives,"Shoshone County, Idaho",,,"MG 5, Stanly Easton. Papers, 1900-1916, University of Idaho Library Special Collections and Archives",MG5_F001_152,text,,application/pdf,http://rightsstatements.org/vocab/NoC-US/1.0/
Anra Rowley,hist454-ar04,https://digital.lib.uidaho.edu/utils/getfile/collection/bunkerhill/id/438.pdf,,"Letter from W. S. Swain to Frederick Burbidge, April 23, 1901","Swain, Wilson S.",1901-04-23,"Swain informs Burbidge that he is working on a possible issue with the operative reports, Swain will be in the region soon.",undercover; reports; travel,"Chicago, Illinois; Kellogg, Idaho",41.8339025,-88.0128369,"MG 5, Stanly Easton. Papers, 1900-1916, University of Idaho Library Special Collections and Archives",MG5_F001_135,text,,application/pdf,http://rightsstatements.org/vocab/NoC-US/1.0/
Anra Rowley,hist454-ar05,https://digital.lib.uidaho.edu/utils/getfile/collection/bunkerhill/id/450.pdf,,"Letter from W. S. Swain to Frederick Burbidge, May 23, 1901","Swain, Wilson S.",1901-05-23,"Swain responds to a previous letter, speculates on the Western Federation of Miners; handwritten.",detectives; undercover,"Spokane, Washington",47.672986,-117.552577,"MG 5, Stanly Easton. Papers, 1900-1916, University of Idaho Library Special Collections and Archives",MG5_F001_150,text,handwritten letter,application/pdf,http://rightsstatements.org/vocab/NoC-US/1.0/
Anra Rowley,hist454-ar06,hist454-AR005.jpg,,Order of Masonic Knights Templar,Barnard Studios,,Three Men Posed in Uniform. Taken for E. L. Gauger.,groups of people; uniforms,,,,"8-A 104, Bernard-Stockbrigde Photograph Collection",8-A104,image;still image,black and white photograph,image/jpeg,http://rightsstatements.org/vocab/NoC-US/1.0/
Anra Rowley,hist454-ar07,hist454-AR004.pdf,,Captain W. S. Swain,W. M. Simpson; The Idaho Magazine,1906-04,"Captain W. S. Swain, Northwesrern Manager of Thiel's Detective Sevice Company, Spokane, WA Charater Sketch article after investigation regarding assasination of Ex-Gov. Steunenberg.",assassination; Thiel Detective Service Company; Mine Owners Association,"Boise, Idaho",43.6154,-116.2136,"MG 367, Bunker Hill Mining Company, Universty of Idaho",MG-367-1576,text,Magazine article,application/pdf,http://rightsstatements.org/vocab/NoC-US/1.0/
Lucas Fritz,hist454-lf002,hist454-lf002.pdf,,Operative Report on Couer d' Alene Mine Workers,,1901-02-20,"Telegraph Report from Wallace, Idaho on the state of the mines, mine workers, mine unions, and operative findings in the Couer d' Alene area. Mine owners have searched out miners from outside Idaho who would not be connected to a union.",mines; mine workers; unions,"Wardner, Idaho; Wallace, Idaho",47.5227,-116.1341,"MG 5, Stanly Easton. Papers, 1900-1916, University of Idaho Library Special Collections and Archives",,Text,Telegram,application/pdf,http://rightsstatements.org/vocab/NoC-US/1.0/
Lucas Fritz,hist454-lf001,hist454-lf001.jpg,,Portrait of Mine Workers in Bull Pen,,1899,"Picture of Mine Workers sitting in the Bull Penn of a mine in Kellogg, Idaho.",mine workers; bull pens,"Kellogg, Idaho",47.5383,-116.1193,"PG 8, Bernard Stockbridge Collection, University of Idaho Library Special Collections and Archives",8-X 537,Image;Stillimage,black-and-white photograph,image/jpeg,http://rightsstatements.org/vocab/NoC-US/1.0/
Lucas Fritz,hist454-lf003,https://digital.lib.uidaho.edu/utils/getfile/collection/bunkerhill/id/451.pdf,,"Operative Report, May 23, 1901",Thiel Detective Service Co.,1901-05-23,"Operative discusses speculation on the Finley trial including the reliability of witnesses, possible suspicious activities taking place at some cabins.",labor disputes; murder; legal disputes; detectives,"Wallace, Idaho",47.4741,-115.9279,"MG 5, Stanly Easton. Papers, 1900-1916, University of Idaho Library Special Collections and Archives",MG5_F001_151,Text,Typed Letter,application/pdf,http://rightsstatements.org/vocab/NoC-US/1.0/
Lucas Fritz,hist454-lf004,https://digital.lib.uidaho.edu/utils/getfile/collection/bunkerhill/id/325.pdf,,"2 operative reports for Bunker Hill & Sullivan M. & C. Co., November 1, 1900, November 4, 1900",Thiel Detective Service Co.,1900-11-01,"Nov. 1: Operative reports that more men have arrived in the hopes of the permit system being disbanded, mentions that Union men are confident that the Democrats will win in the elections. Nov. 4: Operative reports that Union members are being cautious as deputies are looking for any excuse to put them in jail, more miners have arrived believing that the permit system will be revoked.",labor unions; hiring; elections,"Seattle, Washington",47.6062,-122.3321,"MG 5, Stanly Easton. Papers, 1900-1916, University of Idaho Library Special Collections and Archives",MG5_F001_021,Text,Typed Letter,application/pdf,http://rightsstatements.org/vocab/NoC-US/1.0/
Lucas Fritz,hist454-lf005,https://digital.lib.uidaho.edu/utils/getfile/collection/bunkerhill/id/335.pdf,,"Operative report for Larson & Greenough, no date [02]",Thiel Detective Service Co.,1900,"Operative mentions a funeral in Wallace, he is looking for work, lists 46 union men.",funeral; miners; labor unions,"Wallace, Idaho",47.4741,-115.9279,"MG 5, Stanly Easton. Papers, 1900-1916, University of Idaho Library Special Collections and Archives",MG5_F001_031,Text,Typed Letter,application/pdf,http://rightsstatements.org/vocab/NoC-US/1.0/
Lucas Fritz,hist454-lf006,https://digital.lib.uidaho.edu/utils/getfile/collection/bunkerhill/id/440.pdf,,"Stray page in which operative mentions a possible scheme, union membership, a detective in town investigating a recent fight, and donations to legal cases",Thiel Detective Service Co.,1900,"Appears to be a stray page, no date, in which operative mentions a possible scheme, union membership, a detective in town investigating a recent fight, and donations to legal cases.",labor unions; labor disputes; legal disputes,"Wardner, Idaho",47.4741,-116.1341,"MG 5, Stanly Easton. Papers, 1900-1916, University of Idaho Library Special Collections and Archives",MG5_F001_118b,Text,Typed Letter,application/pdf,http://rightsstatements.org/vocab/NoC-US/1.0/
Lucas Fritz,hist454-lf007,https://digital.lib.uidaho.edu/utils/getfile/collection/bunkerhill/id/456.pdf,,"2 operative reports, June 4, 1901, June 5, 1901",Thiel Detective Service Co.,1901-06-04,"June 4: Operative mentions a man who was possibly involved in the explosion at the Bunker Hill & Sullivan Mill, other men are threatening the deputies; June 5: operative mentions possible threats against the deputies and mine managers, the chance of the mines employing union men.",legal disputes; labor disputes; dynamite; labor unions,"Shoshone County, Idaho",47.1747,-115.9105,"MG 5, Stanly Easton. Papers, 1900-1916, University of Idaho Library Special Collections and Archives",MG5_F001_156,Text,Typed Letter,application/pdf,http://rightsstatements.org/vocab/NoC-US/1.0/
Loren Kreisle,hist454-lk01,hist454-LK001.jpg,,Church Choir,"Barnard Studio (Wallace, ID)",1889,Picture of choir members of all ages posing outside Holy Trinity Episcopal Church.,churches; group portraits; children; choirs,"Wallace, Idaho",47.472713,-115.9271745,"PG 8, Barnard-Stockbridge Collection, University of Idaho Library Special Collections and Archives",pg 8-A78,Image;StillImage,black-and-white photograph,image/jpeg,http://rightsstatements.org/vocab/NoC-US/1.0/
Loren Kreisle,hist454-lk02,hist454-LK002.jpg,,Commencement Excercises,"Vance, C.W.",1906-04-23,Letter and speech congratulating students who've completed an education.,schools; education,"Kellogg, Idaho",47.5383,-116.1193,"MG 5, Stanly Easton. Papers, 1900-1916, University of Idaho Library Special Collections and Archives",,Text,letter; typed manuscript,application/pdf,http://rightsstatements.org/vocab/NoC-US/1.0/
Loren Kreisle,hist454-lk03,https://digital.lib.uidaho.edu/digital/api/singleitem/image/bar-stock/239/default.jpg,,"Forest Fire, Brewery","Barnard Studio (Wallace, ID)",1910-08-20,"Aftermath of a forest fire outside a damaged building in Wallace, Idaho.",fires; forest fires; brewery; buildings,"Wallace, Idaho",47.472501,-115.925401,"PG 8, Barnard-Stockbridge Collection, University of Idaho Library Special Collections and Archives",PG 8-C4d,Image;StillImage,black-and-white photograph,image/jpeg,http://rightsstatements.org/vocab/NoC-US/1.0/
Loren Kreisle,hist454-lk04,https://digital.lib.uidaho.edu/digital/api/singleitem/image/bar-stock/2698/default.jpg,,Inspiration Silver Mine,"Barnard Studio (Wallace, ID)",,"A man standing at the entrance to the cave mouth of the Silverore-Inspiration Silver Mine in Osburn, Idaho.",mines; miners; mineshafts; silver,"Osburn, Idaho",47.516282,-115.959108,"PG 8, Barnard-Stockbridge Collection, University of Idaho Library Special Collections and Archives",PG8_B314-4,Image;StillImage,black-and-white photograph,image/jpeg,http://rightsstatements.org/vocab/NoC-US/1.0/
Loren Kreisle,hist454-lk05,https://digital.lib.uidaho.edu/digital/api/singleitem/image/bar-stock/256/default.jpg,,"Bunker Hill ""Glory Hole""","Barnard Studio (Wallace, ID)",1897,"Miners standing around ore cars at Bunker Hill. Caption on front reads, ""Miners work on the original Bunker Hill outcrop.""",mines; miners; ores,"Kellogg, Idaho",47.538278,-116.119363,"PG 8, Barnard-Stockbridge Collection, University of Idaho Library Special Collections and Archives",8-X00024,Image;StillImage,black-and-white photograph,image/jpeg,http://rightsstatements.org/vocab/NoC-US/1.0/
Carson A,hist454-ca01,https://digital.lib.uidaho.edu/digital/iiif/watkins/76/full/max/0/default.jpg,,Mountain Consolidated Mine 550 ft. level East [no. 1242],"Watkins, Carleton E.",1890,Two miners pose in an underground mine,mining; ore; underground,"Butte, Montana",46.017324,-112.510167,"PG 89, University of Idaho Library Special Collections & Archives, https://www.lib.uidaho.edu/digital/watkins/items/watkins76.html",89-1242,Image;StillImage,Photograph,image/jpeg,http://rightsstatements.org/vocab/NoC-US/1.0//
Carson A,hist454-ca02,https://www.lib.uidaho.edu/digital/objects/tabor/pg83-b05-f47-001_001.jpg,,"Possible Funeral for a mining accident that killed 10 people after a cable broke, Mullan, Idaho","Tabor's Photo Service, Wallace Idaho",1936-10-05,"People gather after a mining accident that killed 10 people at Morning Mine. Large bags, containing the bodies of the dead, are being brought out. Machinery and buildings can be seen in the background.",accidents,"Mullan, Idaho",47.47018875,-115.8011691,"PG 83, George W. Tabor Photographs, 1890-2164, https://www.lib.uidaho.edu/digital/tabor/items/tabor0200.html",pg83-b05-f47-001_001,Image;StillImage,Photograph,image/jpeg,http://rightsstatements.org/vocab/InC-EDU/1.0/
Carson A,hist454-ca03,https://digital.lib.uidaho.edu/digital/iiif/spec_hm/5/full/pct:40/0/default.jpg,,Map showing geological formations and mineral lands near the Northern Pacific Railroad in northern Idaho and Washington Territories,"Rinkseeker, D. G.; Tiernan, J. M.",1882,"Map of geological formations and mineral lands near Northern Pacific Railroad in northern Idaho and Washington. Includes Spokane, Pend D'Oreille River and Lake and Lake Coeur D'Alene. 1 in. to 4 miles 1 ms. map: col. ; 87 x 77 cm.",mineral maps,Idaho; Washington,,,"Idaho Historical Maps Collection, University of Idaho Library, https://www.lib.uidaho.edu/digital/historicalmaps/items/spec_hm5.html",geologicalmineral_1882,Image;StillImage,print map,image/jpeg,http://rightsstatements.org/vocab/NoC-US/1.0/
Carson A,hist454-ca04,https://www.lib.uidaho.edu/digital/objects/tabor/pg83-b05-f47-005_004.jpg,,Man standing next to Coeur d'Alene Mining District Mine Rescue Car,"Tabor's Photo Service, Wallace Idaho",1939-01-12,"A man stands next to a Coeur d'Alene Mining District Mine Rescue Car. The text on the automobile also reads ""Wallace Idaho 1939.""",mines; automobiles,"Coeur D'Alene, Idaho",,,"PG 83, George W. Tabor Photographs, 1890-2164, https://www.lib.uidaho.edu/digital/tabor/items/tabor0217.html",pg83-b05-f47-005_004,Image;StillImage,Photograph,image/jpeg,http://rightsstatements.org/vocab/InC-EDU/1.0/
Carson A,hist454-ca05,https://www.lib.uidaho.edu/digital/objects/tabor/pg83-b05-f46-024_001.jpg,,"Labor building on Bank Street, Wallace","Tabor's Photo Service, Wallace Idah",1942-06-16,"The Labor building on Bank Street in Wallace, Idaho. Two cars are parked in front of the building.",employment agencies,"Wallace, Idaho",47.4743398,-115.9201941,"PG 83, George W. Tabor Photographs, 1890-2141, https://www.lib.uidaho.edu/digital/tabor/items/tabor0177.html",pg83-b05-f46-024_001,Image;StillImage,Photograph,image/jpeg,http://rightsstatements.org/vocab/InC-EDU/1.0/
Carson A,hist454-ca06,hist454-CA001.jpg,,Creek at Wallace Becomes Torrent,The Spokesman Review,1933-12-24,"Newspaper article disscussing the effects the flood caused in Wallace, Idaho.",Natural Disaster; Damaged Property,"Wallace, Idaho",47.4741,-115.9279,,1629,Image;StillImage,Newspaper,image/jpeg,http://rightsstatements.org/vocab/InC-EDU/1.0/
Carson A,hist454-ca07,hist454-CA002.pdf,,Raging floods of Coeur d'Alene region wreak heavy damage,The Spokesman Review,1993-12-24,Four pictures with small paragraphs updating readers on the heavy damage in the Coeur d'Alene area due to floods,Floods,"Coeur D'Alene, Idaho",47.6735,-116.7812,,1629,Image;StillImage,Newspaper,application/pdf,http://rightsstatements.org/vocab/InC-EDU/1.0/
Kyrin Beaachem,Hist454-KB01,https://digital.lib.uidaho.edu/utils/getfile/collection/arbornotes/id/0.pdf,,Arbor Notes February 1990,"Kochan, Walter; Naskali, Richard; Renfrew, Malcolm; Steele, Bob",1990-02,This February publication includes the subject headings: Lemhi Penstemon Story; Mark Your Calendars; Upcoming Workshops; Ill Wind Blows; New Plants in the Arboretum; Executive Committee Report; 1989 Annual Meeting; Arboretum Associates Plan to Grow; Bulletin Board; Shattuck Info Sheet; Gratitude List,associations; arboretums,,46.721642,-117.01565,FY90-ARB-ArborNotes-February1990,,text,application/pdf,application/pdf,http://rightsstatements.org/vocab/InC-EDU/1.0/
Kyrin Beaachem,Hist454-KB02,https://digital.lib.uidaho.edu/utils/getfile/collection/bunkerhill/id/114.pdf,,"Letter from Frederick Burbidge to Alex. Granger, August 26, 1899","Burbidge, Frederick",1899-08-26,Burbidge reiterates the request from Bradley to Granger to find and send a letter,correspondence,United States,,,"MG 367, Bunker Hill Company. Records, 1887-1984, University of Idaho Library Special Collections and Archives",MG367_85_096,text,application/pdf,application/pdf,https://creativecommons.org/publicdomain/mark/1.0/
Kyrin Beaachem,Hist454-KB03,,U9O-ENEd7Aw,"University of Idaho vs. Washington State University (Basketball), 01/18/1978",N/A,1978-01-18,Washington State University,Memorial Gymnasium,"Moscow, Idaho",46.726389,-117.01375,Reference Link:https://www.lib.uidaho.edu/digital/vandalvideo/items/vandalvideo38.html,UG64-WSU-bb1978-1_157,image,video,video/mp4,"Educational use includes non-commercial use of text and images in materials for teaching and research purposes. Digital reproduction permissions granted by University of Idaho Library. For other uses beyond educational use, please contact University of Idaho Library Special Collections and Archives Department at libspec@uidaho.edu and University of Idaho Athletic Department."
Kyrin Beaachem,Hist454-KB04,https://digital.lib.uidaho.edu/digital/iiif/p17254coll3/539/full/pct:70/0/default.jpg,,"Vandals basketball player James Fitch, no. 10",N/A,1983,"Vandals basketball player Stan Arnold, number 10, dribbling the ball.",Sports,"Moscow, Idaho",46.726389,-117.01375,"PG52, The Argonaut Photograph Collection",PG52-048,image,image,image/jpeg,http://rightsstatements.org/vocab/InC-EDU/1.0/
Kyrin Beaachem,Hist454-KB05,https://www.lib.uidaho.edu/digital/objects/moscon/MosCon10-1988_000.pdf,,"MosCon X, Sepember 23-25, 1988","Moscow Science Fiction Conventions, Inc.",1988-09-23,"A special extended program book for the tenth anniversary Moscon in 1988. Guests of Honor: Anne McCaffrey; Lela Dowling; Ken Macklin; Robert L. Forward; Ed and Norma Beauregard. Special thanks to the Telgar Weyr of Spokane, and to all the wonderful volunteers who have made this convention not only possible, but a resounding success. And we would like to thank all the previous committee members of MosCon, without whose tireless efforts this convention would not be nearly as good as it is. Thank you all.",science fiction; authors; artists,"Moscow, Idaho",,,https://www.lib.uidaho.edu/digital/moscon/items/moscon10-1988_000.html,MosCon10-1988_000,text,print,application/pdf,http://rightsstatements.org/vocab/InC-EDU/1.0/
Kyrin Beaachem,Hist454-KB06,https://www.lib.uidaho.edu/digital/objects/campushistory/old/002_002.jpg,,Alpha Phi House,N/A,1925,University of Idaho Student Organizations Collection,sororities; sorority houses,"Moscow, Idaho",,,https://www.lib.uidaho.edu/digital/campushistory/items/pg261.html,N/A,image,image,image/jpeg,http://rightsstatements.org/vocab/NoC-US/1.0/
Kyrin Beaachem,Hist454-KB07,https://digital.lib.uidaho.edu/digital/iiif/stonebraker/373/full/max/0/default.jpg,,Dr. J.M. Woodburn on horseback [02],N/A,1903,"Sumner (Governor) Stonebraker in the background. ""Trying our cameras on moving objects.""",horses,,46.102219,-115.978417,"William Allen Stonebraker Photographs, Photo Group 26",PG26-S2-062,image,3.25x3.25 black and white print,image/jpeg,http://rightsstatements.org/vocab/NoC-US/1.0/
"Jones, Matthew",hist454-MRJ001,hist454-MRJ001.jpg,,Noah Kellogg's Burro,"Barnard Studio (Wallace, Idaho)",1886,"Early-day street scene in Wardner. Noah Kellogg's burro that discovered the Bunker Hill and Sullivan Mine. Boys riding are Jerome Day, Sam and Frank Poteet.",Commercial Buildings; buisness; groups of people,"Wardner, Idaho",47.524592,-116.138677,"PG 8, Barnard-Stockbridge Collection, University of Idaho Library Special Collections and Archives, http://www.lib.uidaho.edu/special-collections/",8-x00548a,Image,8x10 black and white glass negative,image/jpeg,http://rightsstatements.org/vocab/NoC-US/1.0/
"Jones, Matthew",hist454-MRJ002,hist454-MRJ002.pdf,,"Transcript of two tapes recorded by Stanley A. Easton. 21 OCT, 1957",Beverly A. Branson,1984-03-07,"This is a transcript of two tapes that contain the testemate of Stanley A. Easton. These tapes were used to aid in the writing of Stanlety A. Easton, 64 years of mining, by Charles R. Stark, OCT 1956",audio tapes,"Moscow, Idaho",46.7324,-117.0002,University of Idaho Special Collections: Bernard Stockbridge Collection,"TN-24, I2B83",Text Doccument,Printed Document,application/pdf,http://rightsstatements.org/vocab/NoC-US/1.0/
"Jones, Matthew",hist454-MRJ003,https://digital.lib.uidaho.edu/digital/iiif/bar-stock/191/full/max/0/default.jpg,,"Wardner (Idaho), School, 1907","Barnard Studio (Wallace, Idaho)",1907,"Wardner school, built in 1905.",schools,"Kellogg, Idaho",47.521019,-116.138669,"PG 8, Barnard-Stockbridge Collection, University of Idaho Library Special Collections and Archives, http://www.lib.uidaho.edu/special-collections/",PG 8-X215,Image,8x10 Black and White glass negative,image/jpeg,http://rightsstatements.org/vocab/NoC-US/1.0/
"Jones, Matthew",hist454-MRJ004,https://digital.lib.uidaho.edu/digital/iiif/bar-stock/969/full/pct:70/0/default.jpg,,"Last Chance Mine and Mill, Wardner (Idaho) [02]","Barnard Studio (Wallace, Idaho)",1904,Exterior of the mill with a horse tied up,mills; riding horses,"Kellogg, Idaho",47.521877,-116.133589,"PG 8, Barnard-Stockbridge Collection",PG 8-X516,Image,8x10 Black and White glass negative,image/jpeg,http://rightsstatements.org/vocab/NoC-US/1.0/
"Jones, Matthew",hist454-MRJ005,https://digital.lib.uidaho.edu/digital/iiif/bar-stock/1032/full/max/0/default.jpg,,"Bunker Hill Mine, Wardner (Idaho)","Barnard Studio (Wallace, Idaho)",1908,Picture of Bunker Hill Mine,mine buildings,"Kellogg, Idaho",47.512797,-116.142551,"PG 8, Barnard-Stockbridge Collection",PG 8-X535,Image,8x10 Black and White glass negative,image/jpeg,http://rightsstatements.org/vocab/NoC-US/1.0/
"Jones, Matthew",hist454-MRJ006,https://digital.lib.uidaho.edu/digital/iiif/bar-stock/2109/full/max/0/default.jpg,,Newspaper Photo,"Barnard Studio (Wallace, Idaho)",1905-03-02,"Newspaper photo of the Bunker Hill and Sullivan Mill in Wardner, Idaho. This was the first milling plant at Bunker Hill. The mine has since produced $58,260,241 in dividends.",mills; News Photographs,"Wardner, Idaho",47.513303,-116.141795,"PG 8, Barnard-Stockbridge Collection",B258,Image,5x7 black and white film copy negative,image/jpeg,http://rightsstatements.org/vocab/NoC-US/1.0/
"Jones, Matthew",hist454-MRJ007,https://digital.lib.uidaho.edu/digital/iiif/bar-stock/1568/full/max/0/default.jpg,,Wardner Fire [01],"Barnard Studio (Wallace, Idaho)",1910,"View of Wardner, Idaho after the fire.",fires,"Wardner, Idaho",47.526642,-116.129147,"PG 8, Barnard-Stockbridge Collection",B14-2,Image,4.25x6.25 black and white film negative,image/jpeg,http://rightsstatements.org/vocab/NoC-US/1.0/
"Jones, Matthew",hist454-MRJ008,https://digital.lib.uidaho.edu/digital/iiif/bar-stock/964/full/max/0/default.jpg,,"Sullivan Mine, Wardner (Idaho) 1887","Barnard Studio (Wallace, Idaho)",1887,"Nicknamed ""Dutch Jake,"" picture of a mine",Barnard; Stockbridge; Photograph collections; mine buildings,"Kellogg, Idaho",47.512797,-116.142551,"PG 8, Barnard-Stockbridge Collection",PG 8-X510,Image,8x10 black and white glass negative,image/jpeg,http://rightsstatements.org/vocab/NoC-US/1.0/
Kyli Pierson,hist454-kp01,https://digital.lib.uidaho.edu/utils/getfile/collection/bunkerhill/id/12.pdf,,Unsigned Letter to W.W. Woods,University of Idaho,1899-04-01,Explaining settlement options regarding damages incurred on property owned by a Mr. Root,settlements,"Unites States; Kellogg, Idaho; Wallace, Idaho; Shoshone County, Idaho",,,"MG 367, Bunker Hill Company. Records, 1887-1984, University of Idaho Library Special Collections and Archives",MG367_84_001,Typed text,,application/pdf,http://rightsstatments.org/vocab/NoC-US/1.0/
Kyli Pierson,hist454-kp02,https://digital.lib.uidaho.edu/utils/getfile/collection/bunkerhill/id/353.pdf,,Letter from W. St. M. Barnes to Frederick Burbidge,"Barnes, W. St. M.",1900-12-12,Barnes informs Burbidge of the enclosed bill for services and expenses incurred during the month of November,Invoices,"Seattle, Washington; Kellogg, Idaho; King County, Washington; Shoshone County, Idaho",,,"MG 5, Stanly Easton. Papers, 1900-1916, University of Idaho Library Special Collections and Archives",MG5_F001_051,Typed Text,,application/pdf,http://rightsstatments.org/vocab/NoC-US/1.0/
Kyli Pierson,hist454-kp03,https://digital.lib.uidaho.edu/utils/getfile/collection/bunkerhill/id/412.pdf,,Operative Report,Thiel Detective Service Co.,1901-02-22,"Operative reports some men are angry over the men out of town getting work, miners are working under assumed names, rumor that some mine employees are frusturated with the system.",labor disputes; murder; undercover; miners; foreman,"Wallace, Idaho; Shoshone County, Idaho",,,"MG 5, Stanly Easton. Papers, 1900-1916, University of Idaho Library Special Collections and Archives",MG5_F001_111,Handwritten Text,,application/pdf,http://rightsstatments.org/vocab/NoC-US/1.0/
Kyli Pierson,hist454-kp04,https://digital.lib.uidaho.edu/digital/iiif/bar-stock/684/full/max/0/default.jpg,,Big Creek Mining Co. Wallace,"Barnard Studio (Wallace, Idaho)",1920,Image shows Big Creek Mining Company outside of Wallace Idaho,mine buildings; mines; extracting; dwellings,"Wallace, Idaho",47.505033,-116.076033,"PG 8, Barnard-Stockbridge Collection",PG 8-X607d,Image; Still Image,8x10 black and white glass negative,image/jpeg,http://rightsstatments.org/vocab/NoC-US/1.0/
Kyli Pierson,hist454-kp05,https://digital.lib.uidaho.edu/digital/iiif/bar-stock/1767/full/max/0/default.jpg,,Sunshine Mine [08],"Barnard Studio (Wallace, Idaho)",1935-06-23,"The mill on Sunshine Mine in Kellogg, Idaho.",mills; mines,"Kellogg, Idaho",47.502389,-116.070793,"PG 8, Barnard-Stockbridge Collection",B167-1,Image; Still Image,4x5 black and white film negative,image/jpeg,http://rightsstatements.org/vocab/InC-EDU/1.0/
Kyli Pierson,hist454-kp06,hist454-kp06.jpg,,Boarding House for Miners,"Barnard Studio (Wallace, Idaho)",1910,Boarding house for miners in Mullin Idaho.,building; mines; housing,"Mullan, Idaho",,,University of Idaho Library Special Collections and Archives,,Image; Still Image,black and white photograph,image/jpeg,http://rightsstatments.org/vocab/NoC-US/1.0/
Kyli Pierson,hist454-kp07,hist454-kp07.pdf,,Letter from Frank S. Dietrich to Stanley A. Easton,Frank S. Dietrich,1907-03-27,Dietrich thanking Easton for his support and assistance in his federal judgeship canidacy.,Easton; Dietrich; judgeship; canidacy,"Pocatello, Idaho; Kellogg, Idaho; Wallace, Idaho",,,University of Idaho Library Special Collections and Archives,,Typed Text,,application/pdf,http://rightsstatements.org/vocab/InC-EDU/1.0/
